{
  "code": "01",
  "name_vi": "Thành phố Hà Nội",
  "name_en": "Hanoi Municipality",
  "level": "province",
  "parent_code": null,
  "valid_from": "2025-07-01",
  "valid_to": null,
  "predecessor_codes": ["01", "26"],
  "successor_codes": [],
  "provenance": {
    "source_id": "manual",
    "source_url": "https://danhmuchanhchinh.vn/",
    "retrieved_at": "2026-07-27T00:00:00Z",
    "retrieval_method": "manual",
    "license_status": "reference-only",
    "attribution": "Cổng thông tin đơn vị hành chính",
    "confidence": "partial",
    "notes": "Phase 0 example. Code '01' retained after merger with Hà Tây (code '26') per 2025 administrative reorganization. Valid_from date is illustrative; actual merger date pending official gazette publication."
  }
}
